org_code,name,addr1,addr2,addr3,city,county,postcode
RY9,Hounslow and Richmond Community Healthcare NHS Trust,Thames House,180 - 194 High Street,,Teddington,Middlesex,TW11 8HU
RYA,West Midlands Ambulance Service NHS Foundation Trust,Waterfront Business Park,Waterfront Way,,Brierley Hill,West Midlands,DY5 1LX
RYC,East of England Ambulance Service NHS Trust,Ambulance Station,Hospital Lane,Hellesdon,Norwich,Norfolk,NR6 5NA
RYD,South East Coast Ambulance Service NHS Foundation Trust,40-42 Friars Walk,,,Lewes,East Sussex,BN7 2XW
RYE,South Central Ambulance Service NHS Foundation Trust,7-8 Talisman Road,,,Bicester,Oxfordshire,OX26 6HR
RYF,South Western Ambulance Service NHS Foundation Trust,Westcountry House,"Abbey Court, Eagle Way",Sowton Industrial Estate,Exeter,Devon,EX2 7HY
RYG,Coventry and Warwickshire Partnership NHS Trust,Wayside House,Wilsons Lane,,Coventry,West Midlands,CV6 6NY
RYJ,Imperial College Healthcare NHS Trust,St. Marys Hospital,Praed Street,,London,Greater London,W2 1NY
RYK,Dudley and Walsall Mental Health Partnership NHS Trust,Trafalgar House,47-49 King Street,,Dudley,West Midlands,DY2 8PS
RYR,Western Sussex Hospitals NHS Foundation Trust,Worthing Hospital,Lyndhurst Road,,Worthing,West Sussex,BN11 2DH
RYT,Public Health Wales NHS Trust,Number 2,Capital Quarter,Tyndall Street,Cardiff,South Glamorgan,CF10 4BZ
RYV,Cambridgeshire Community Services NHS Trust,Unit 3,Meadow Lane,,St. Ives,Cambridgeshire,PE27 4LG
RYW,Birmingham Community Healthcare NHS Foundation Trust,"3, Priestley Wharf","Holt Street,","Birmingham Science Park, Aston",Birmingham,West Midlands,B7 4BN
RYX,Central London Community Healthcare NHS Trust,Ground Floor,15 Marylebone Road,,London,Greater London,NW1 5JD
RYY,Kent Community Health NHS Foundation Trust,"Unit D, the Oast",Hermitage Court,Barming,Maidstone,Kent,ME16 9NT
TAD,Bradford District Care NHS Foundation Trust,New Mill,Victoria Road,Saltaire,Shipley,West Yorkshire,BD18 3LA
TAE,Manchester Mental Health and Social Care Trust,Chorlton House,70 Manchester Road,Chorlton Cum Hardy,Manchester,Greater Manchester,M21 9UN
TAF,Camden and Islington NHS Foundation Trust,St. Pancras Hospital,4 St. Pancras Way,,London,Greater London,NW1 0PE
TAH,Sheffield Health & Social Care NHS Foundation Trust,Fulwood House,Old Fulwood Road,,Sheffield,South Yorkshire,S10 3TH
TAJ,Black Country Partnership NHS Foundation Trust,Delta Point,Greets Green Road,,West Bromwich,West Midlands,B70 9PL
