org_code,name,addr1,addr2,addr3,city,county,postcode
R0A,Manchester University NHS Foundation Trust,Cobbett House,Oxford Road,,Manchester,Greater Manchester,M13 9WL
R1A,Worcestershire Health and Care NHS Trust,Isaac Maddox House,Shrub Hill Industrial Estate,,Worcester,Worcestershire,WR4 9RW
R1C,Solent NHS Trust,Solent NHS Trust Headquarters,Highpoint Venue,Bursledon Road,Southampton,Hampshire,SO19 8BR
R1D,Shropshire Community Health NHS Trust,William Farr House,Mytton Oak Road,,Shrewsbury,Shropshire,SY3 8XL
R1E,Staffordshire and Stoke on Trent Partnership NHS Trust,"2ND Floor, Morston House",,,Newcastle-Under-Lyme,Staffordshire,ST5 1QG
R1F,Isle of Wight NHS Trust,St Mary's Hospital,Parkhurst Road,,Newport,Isle of Wight,PO30 5TG
R1H,Barts Health NHS Trust,The Royal London Hospital,Whitechapel,,London,Greater London,E1 1BB
R1J,Gloucestershire Care Services NHS Trust,Edward Jenner Court,1010 Pioneer Avenue,"Gloucester Business PK, Brockworth",Gloucester,Gloucestershire,GL3 4AW
R1K,London North West Healthcare NHS Trust,Northwick Park Hospital,Watford Road,,Harrow,Middlesex,HA1 3UJ
R1L,Essex Partnership University NHS Foundation Trust,The Lodge,Runwell Chase,Runwell,Wickford,Essex,SS11 7XX
RA2,Royal Surrey County Hospital NHS Foundation Trust,Egerton Road,,,Guildford,Surrey,GU2 7XX
RA3,Weston Area Health NHS Trust,Weston General Hospital,Grange Road,Uphill,Weston-Super-Mare,Avon,BS23 4TQ
RA4,Yeovil District Hospital NHS Foundation Trust,Yeovil District Hospital,Higher Kingston,,Yeovil,Somerset,BA21 4AT
RA7,University Hospitals Bristol NHS Foundation Trust,Marlborough Street,,,Bristol,Avon,BS1 3NU
RA9,Torbay and South Devon NHS Foundation Trust,Hengrave House,Torbay Hospital,Newton Road,Torquay,Devon,TQ2 7AA
RAE,Bradford Teaching Hospitals NHS Foundation Trust,Bradford Royal Infirmary,Duckworth Lane,,Bradford,West Yorkshire,BD9 6RJ
RAJ,Southend University Hospital NHS Foundation Trust,Prittlewell Chase,,,Westcliff-On-Sea,Essex,SS0 0RY
RAL,Royal Free London NHS Foundation Trust,Royal Free Hospital,Pond Street,,London,Greater London,NW3 2QG
RAN,Royal National Orthopaedic Hospital NHS Trust,Brockley Hill,,,Stanmore,Middlesex,HA7 4LP
RAP,North Middlesex University Hospital NHS Trust,Sterling Way,,,London,Greater London,N18 1QX
RAS,The Hillingdon Hospitals NHS Foundation Trust,Pield Heath Road,,,Uxbridge,Middlesex,UB8 3NN
RAT,North East London NHS Foundation Trust,West Wing,C E M E Centre,Marsh Way,Rainham,Essex,RM13 8GQ
RAX,Kingston Hospital NHS Foundation Trust,Galsworthy Road,,,Kingston Upon Thames,Surrey,KT2 7QB
RBA,Taunton and Somerset NHS Foundation Trust,Musgrove Park Hospital,,,Taunton,Somerset,TA1 5DA
RBD,Dorset County Hospital NHS Foundation Trust,Dorset County Hospital,Williams Avenue,,Dorchester,Dorset,DT1 2JY
RBK,Walsall Healthcare NHS Trust,Manor Hospital,Moat Road,,Walsall,West Midlands,WS2 9PS
RBL,Wirral University Teaching Hospital NHS Foundation Trust,Arrowe Park Hospital,Arrowe Park Road,Upton,Wirral,Merseyside,CH49 5PE
RBN,St Helens and Knowsley Hospital Services NHS Trust,Whiston Hospital,Warrington Road,,Prescot,Merseyside,L35 5DR
RBQ,Liverpool Heart and Chest Hospital NHS Foundation Trust,Thomas Drive,,,Liverpool,Merseyside,L14 3PE
RBS,Alder Hey Children's NHS Foundation Trust,Alder Hey Hospital,Eaton Road,West Derby,Liverpool,Merseyside,L12 2AP
RBT,Mid Cheshire Hospitals NHS Foundation Trust,Leighton Hospital,Leighton,,Crewe,Cheshire,CW1 4QJ
RBV,The Christie NHS Foundation Trust,550 Wilmslow Road,Withington,,Manchester,Greater Manchester,M20 4BX
RBZ,Northern Devon Healthcare NHS Trust,North Devon District Hospital,Raleigh Park,,Barnstaple,Devon,EX31 4JB
RC1,Bedford Hospital NHS Trust,South Wing,Kempston Road,,Bedford,Bedfordshire,MK42 9DJ
RC9,Luton and Dunstable University Hospital NHS Foundation Trust,Lewsey Road,,,Luton,Bedfordshire,LU4 0DZ
RCB,York Teaching Hospital NHS Foundation Trust,York Hospital,Wigginton Road,,York,North Yorkshire,YO31 8HE
RCD,Harrogate and District NHS Foundation Trust,Strayside Wing,Harrogate District Hospital,Lancaster Park Road,Harrogate,North Yorkshire,HG2 7SX
RCF,Airedale NHS Foundation Trust,Airedale General Hospital,Skipton Road,Steeton,Keighley,West Yorkshire,BD20 6TD
RCU,Sheffield Children's NHS Foundation Trust,Western Bank,,,Sheffield,South Yorkshire,S10 2TH
RCX,"The Queen Elizabeth Hospital, King's LYNN, NHS Foundation Trust",Queen Elizabeth Hospital,Gayton Road,,Kings LYNN,Norfolk,PE30 4ET
RD1,Royal United Hospitals Bath NHS Foundation Trust,Combe Park,,,Bath,Avon,BA1 3NG
RD3,Poole Hospital NHS Foundation Trust,Longfleet Road,,,Poole,Dorset,BH15 2JB
RD8,Milton Keynes University Hospital NHS Foundation Trust,Standing Way,Eaglestone,,Milton Keynes,Buckinghamshire,MK6 5LD
RDD,Basildon and Thurrock University Hospitals NHS Foundation Trust,Basildon Hospital,,Nethermayne,Basildon,Essex,SS16 5NL
RDE,Colchester Hospital University NHS Foundation Trust,Colchester District General HO,Turner Road,,Colchester,Essex,CO4 5JL
RDR,Sussex Community NHS Foundation Trust,Brighton General Hospital,Elm Grove,,Brighton,East Sussex,BN2 3EW
RDU,Frimley Health NHS Foundation Trust,Portsmouth Road,,Frimley,Camberley,Surrey,GU16 7UJ
RDY,Dorset Healthcare University NHS Foundation Trust,Sentinel House,4-6 Nuffield Road,Nuffield Industrial Estate,Poole,Dorset,BH17 0RB
RDZ,The Royal Bournemouth and Christchurch Hospitals NHS Foundation Trust,Royal Bournemouth General Hospital,Castle Lane East,,Bournemouth,Dorset,BH7 7DW
RE9,South Tyneside NHS Foundation Trust,South Tyneside District Hospital,Harton Lane,,South Shields,Tyne and Wear,NE34 0PL
REF,Royal Cornwall Hospitals NHS Trust,Royal Cornwall Hospital,,Treliske,Truro,Cornwall,TR1 3LJ
REM,Aintree University Hospital NHS Foundation Trust,University Hospital Aintree,Fazakerley Hospital,Lower Lane,Liverpool,Merseyside,L9 7AL
REN,The Clatterbridge Cancer Centre NHS Foundation Trust,Clatterbridge Road,,Bebington,Wirral,Merseyside,CH63 4JY
REP,Liverpool Women's NHS Foundation Trust,Liverpool Womens Hospital,Crown Street,,Liverpool,Merseyside,L8 7SS
RET,The Walton Centre NHS Foundation Trust,Lower Lane,,,Liverpool,Merseyside,L9 7LJ
RF4,"Barking, Havering and Redbridge University Hospitals NHS Trust",Queens Hospital,Rom Valley Way,,Romford,Essex,RM7 0AG
RFF,Barnsley Hospital NHS Foundation Trust,Gawber Road,,,Barnsley,South Yorkshire,S75 2EP
RFR,The Rotherham NHS Foundation Trust,Moorgate Road,,,Rotherham,South Yorkshire,S60 2UD
RFS,Chesterfield Royal Hospital NHS Foundation Trust,Calow,,,Chesterfield,Derbyshire,S44 5BL
RGD,Leeds and York Partnership NHS Foundation Trust,Twenty One Fifty,Thorpe Park,,Leeds,West Yorkshire,LS15 8ZB
RGM,Papworth Hospital NHS Foundation Trust,Papworth Everard,,,Cambridge,Cambridgeshire,CB23 3RE
RGN,North West Anglia NHS Foundation Trust,Edith Cavell Hospital,Bretton Gate,Bretton,Peterborough,Cambridgeshire,PE3 9GZ
RGP,James Paget University Hospitals NHS Foundation Trust,Lowestoft Road,,Gorleston,Great Yarmouth,Norfolk,NR31 6LA
RGQ,Ipswich Hospital NHS Trust,Heath Road,,,Ipswich,Suffolk,IP4 5PD
RGR,West Suffolk NHS Foundation Trust,Hardwick Lane,,,Bury St Edmunds,Suffolk,IP33 2QZ
RGT,Cambridge University Hospitals NHS Foundation Trust,Addenbrookes Hospital,Hills Road,,Cambridge,Cambridgeshire,CB2 0QQ
RH5,Somerset Partnership NHS Foundation Trust,2ND Floor,Mallard Court,"Express Park, Bristol Road",Bridgwater,Somerset,TA6 4RN
RH8,Royal Devon and Exeter NHS Foundation Trust,Royal Devon & Exeter Hospital,Barrack Road,,Exeter,Devon,EX2 5DW
RHA,Nottinghamshire Healthcare NHS Foundation Trust,"The Resource, Trust HQ",Duncan Macmillan House,Porchester Road,Nottingham,Nottinghamshire,NG3 6AA
RHM,University Hospital Southampton NHS Foundation Trust,Mailpoint 18,Southampton General Hospital,Tremona Road,Southampton,Hampshire,SO16 6YD
RHQ,Sheffield Teaching Hospitals NHS Foundation Trust,Northern General Hospital,Herries Road,,Sheffield,South Yorkshire,S5 7AU
RHU,Portsmouth Hospitals NHS Trust,DE LA Court House,Queen Alexandra Hospital,Southwick Hill Road,Portsmouth,Hampshire,PO6 3LY
RHW,Royal Berkshire NHS Foundation Trust,Royal Berkshire Hospital,London Road,,Reading,Berkshire,RG1 5AN
RJ1,Guy's and St Thomas' NHS Foundation Trust,Trust Offices,Guy's Hospital,Great Maze Pond,London,Greater London,SE1 9RT
RJ2,Lewisham and Greenwich NHS Trust,University Hospital Lewisham,Lewisham High Street,,London,Greater London,SE13 6LH
RJ6,Croydon Health Services NHS Trust,Croydon University Hospital,London Road,,Thornton Heath,Surrey,CR7 7YE
RJ7,St George's University Hospitals NHS Foundation Trust,St George's Hospital,Blackshaw Road,Tooting,London,Greater London,SW17 0QT
RJ8,Cornwall Partnership NHS Foundation Trust,Porthpean Road,,,St Austell,Cornwall,PL26 6AD
RJC,South Warwickshire NHS Foundation Trust,Warwick Hospital,Lakin Road,,Warwick,Warwickshire,CV34 5BW
RJD,Mid Staffordshire NHS Foundation Trust,Stafford Hospital,Weston Road,,Stafford,Staffordshire,ST16 3SA
RJE,University Hospitals of North Midlands NHS Trust,Newcastle Road,,,Stoke-On-Trent,Staffordshire,ST4 6QG
RJF,Burton Hospitals NHS Foundation Trust,Queen's Hospital,Belvedere Road,,Burton-On-Trent,Staffordshire,DE13 0RB
RJL,Northern Lincolnshire and Goole NHS Foundation Trust,Diana Princess of Wales Hospital,Scartho Road,,Grimsby,South Humberside,DN33 2BA
RJN,East Cheshire NHS Trust,Macclesfield District Gen Hospital,Victoria Road,,Macclesfield,Cheshire,SK10 3BL
RJR,Countess of Chester Hospital NHS Foundation Trust,The Countess of Chester Health Park,,,Chester,Cheshire,CH2 1UL
RJX,Calderstones Partnership NHS Foundation Trust,Mitton Road,,Whalley,Clitheroe,Lancashire,BB7 9PE
RJZ,King's College Hospital NHS Foundation Trust,Denmark Hill,,,London,Greater London,SE5 9RS
RK5,Sherwood Forest Hospitals NHS Foundation Trust,Mansfield Road,,,Sutton-In-Ashfield,Nottinghamshire,NG17 4JL
RK9,Plymouth Hospitals NHS Trust,Derriford Hospital,Derriford Road,,Plymouth,Devon,PL6 8DH
RKB,University Hospitals Coventry and Warwickshire NHS Trust,Walsgrave General Hospital,Clifford Bridge Road,,Coventry,West Midlands,CV2 2DX
RKE,The Whittington Health NHS Trust,The Whittington Hospital,Magdala Avenue,,London,Greater London,N19 5NF
RKL,West London Mental Health NHS Trust,Trust Headquarters,St Bernards Hospital,Uxbridge Road,Southall,Middlesex,UB1 3EU
RL1,The Robert Jones and Agnes Hunt Orthopaedic Hospital NHS Foundation Trust,Gobowen,,,Oswestry,Shropshire,SY10 7AG
RL4,The Royal Wolverhampton NHS Trust,New Cross Hospital,Wolverhampton Road,Heath Town,Wolverhampton,West Midlands,WV10 0QP
RLN,City Hospitals Sunderland NHS Foundation Trust,Sunderland Royal Hospital,Kayll Road,,Sunderland,Tyne and Wear,SR4 7TP
RLQ,Wye Valley NHS Trust,County Hospital,Union Walk,,Hereford,Herefordshire,HR1 2ER
RLT,George Eliot Hospital NHS Trust,Lewes House,College Street,,Nuneaton,Warwickshire,CV10 7DJ
RLU,Birmingham Women's NHS Foundation Trust,Birmingham Womens Hospital,Metchley Park Road,,Birmingham,West Midlands,B15 2TG
RLY,North Staffordshire Combined Healthcare NHS Trust,Bellringer Road,Trentham,,Stoke-On-Trent,Staffordshire,ST4 8HH
RM1,Norfolk and Norwich University Hospitals NHS Foundation Trust,Colney Lane,Colney,,Norwich,Norfolk,NR4 7UY
RM2,University Hospital of South Manchester NHS Foundation Trust,Wythenshawe Hospital,Southmoor Road,Wythenshawe,Manchester,Greater Manchester,M23 9LT
RM3,Salford Royal NHS Foundation Trust,Salford Royal,Stott Lane,,Salford,Greater Manchester,M6 8HD
RMC,Bolton NHS Foundation Trust,The Royal Bolton Hospital,Minerva Road,Farnworth,Bolton,Lancashire,BL4 0JR
RMP,Tameside and Glossop Integrated Care NHS Foundation Trust,Tameside General Hospital,Fountain Street,,Ashton-Under-Lyne,Lancashire,OL6 9RW
RMY,Norfolk and Suffolk NHS Foundation Trust,Hellesdon Hospital,Drayton High Road,,Norwich,Norfolk,NR6 5BE
RN3,Great Western Hospitals NHS Foundation Trust,Great Western Hospital,Marlborough Road,,Swindon,Wiltshire,SN3 6BB
RN5,Hampshire Hospitals NHS Foundation Trust,Aldermaston Road,,,Basingstoke,Hampshire,RG24 9NA
RN7,Dartford and Gravesham NHS Trust,Darent Valley Hospital,Darenth Wood Road,,Dartford,Kent,DA2 8DA
RNA,The Dudley Group NHS Foundation Trust,C Block,Russells Hall Hospital,Pensnett Road,Dudley,West Midlands,DY1 2HQ
RNK,Tavistock and Portman NHS Foundation Trust,The Tavistock Centre,120 Belsize Lane,,London,Greater London,NW3 5BA
RNL,North Cumbria University Hospitals NHS Trust,West Cumberland Hospital,Hensingham,,Whitehaven,Cumbria,CA28 8JG
RNN,Cumbria Partnership NHS Foundation Trust,Carleton Clinic,Cumwhinton Road,,Carlisle,Cumbria,CA1 3SX
RNQ,Kettering General Hospital NHS Foundation Trust,Rothwell Road,,,Kettering,Northamptonshire,NN16 8UZ
RNS,Northampton General Hospital NHS Trust,Cliftonville,,,Northampton,Northamptonshire,NN1 5BD
RNU,Oxford Health NHS Foundation Trust,Corporate Headquarters,4000 John Smith Drive,Oxford Business Park South,Oxford,Oxfordshire,OX4 2GX
RNZ,Salisbury NHS Foundation Trust,Salisbury District Hospital,Odstock Road,,Salisbury,Wiltshire,SP2 8BJ
RP1,Northamptonshire Healthcare NHS Foundation Trust,Sudborough House,St. Marys Hospital,77 London Road,Kettering,Northamptonshire,NN15 7PW
RP4,Great Ormond Street Hospital for Children NHS Foundation Trust,Great Ormond Street,,,London,Greater London,WC1N 3JH
RP5,Doncaster and Bassetlaw Teaching Hospitals NHS Foundation Trust,Doncaster Royal Infirmary,Armthorpe Road,,Doncaster,South Yorkshire,DN2 5LT
RP6,Moorfields Eye Hospital NHS Foundation Trust,162 City Road,,,London,Greater London,EC1V 2PD
RP7,Lincolnshire Partnership NHS Foundation Trust,Unit's 8 & 9,The Point,Lions Way,Sleaford,Lincolnshire,NG34 8GG
RPA,Medway NHS Foundation Trust,Medway Maritime Hospital,Windmill Road,,Gillingham,Kent,ME7 5NY
RPC,Queen Victoria Hospital NHS Foundation Trust,Holtye Road,,,East Grinstead,West Sussex,RH19 3DZ
RPG,Oxleas NHS Foundation Trust,Pinewood House,Pinewood Place,,Dartford,Kent,DA2 7WG
RPY,The Royal Marsden NHS Foundation Trust,Fulham Road,,,London,Greater London,SW3 6JJ
RQ3,Birmingham Women's and Children's NHS Foundation Trust,Steelhouse Lane,,,Birmingham,West Midlands,B4 6NH
RQ6,Royal Liverpool and Broadgreen University Hospitals NHS Trust,Royal Liverpool University Hospital,Prescot Street,,Liverpool,Merseyside,L7 8XP
RQ8,Mid Essex Hospital Services NHS Trust,Broomfield Hospital,Court Road,,Chelmsford,Essex,CM1 7ET
RQF,Velindre NHS Trust,Unit 2,Charnwood Court,Heol Billingsley,Cardiff,South Glamorgan,CF15 7QZ
RQM,Chelsea and Westminster Hospital NHS Foundation Trust,Chelsea & Westminster Hospital,369 Fulham Road,,London,Greater London,SW10 9NH
RQQ,Hinchingbrooke Health Care NHS Trust,Hinchingbrooke Hospital,,,Huntingdon,Cambridgeshire,PE29 6NT
RQW,The Princess Alexandra Hospital NHS Trust,Hamstel Road,,,Harlow,Essex,CM20 1QX
RQX,Homerton University Hospital NHS Foundation Trust,Homerton Row,,,London,Greater London,E9 6SR
RQY,South West London and St George's Mental Health NHS Trust,Springfield Hospital,61 Glenburnie Road,,London,Greater London,SW17 7DJ
RR1,Heart of England NHS Foundation Trust,Birmingham Heartlands Hospital,Bordesley Green East,,Birmingham,West Midlands,B9 5ST
RR7,Gateshead Health NHS Foundation Trust,Queen Elizabeth Hospital,,,Gateshead,Tyne and Wear,NE9 6SX
RR8,Leeds Teaching Hospitals NHS Trust,St. James's University Hospital,Beckett Street,,Leeds,West Yorkshire,LS9 7TF
RRD,North Essex Partnership University NHS Foundation Trust,Stapleford House,Stapleford Close,,Chelmsford,Essex,CM2 0QX
RRE,South Staffordshire and Shropshire Healthcare NHS Foundation Trust,Trust Headquarters,St. Georges Hospital,Corporation Street,Stafford,Staffordshire,ST16 3SR
RRF,"Wrightington, Wigan and Leigh NHS Foundation Trust",The Elms,Royal Albert Edward Infirmary,Wigan Lane,Wigan,Lancashire,WN1 2NN
RRJ,The Royal Orthopaedic Hospital NHS Foundation Trust,The Woodlands,Bristol Road South,Northfield,Birmingham,West Midlands,B31 2AP
RRK,University Hospitals Birmingham NHS Foundation Trust,"Trust HQ, PO Box 9551",Queen Elizabeth Medical Centre,Edgbaston,Birmingham,West Midlands,B15 2TH
RRP,"Barnet, Enfield and Haringey Mental Health NHS Trust",Trust Headquarters Block B2,St Ann's Hospital,St Ann's Road,London,Greater London,N15 3TH
RRU,London Ambulance Service NHS Trust,220 Waterloo Road,,,London,Greater London,SE1 8SD
RRV,University College London Hospitals NHS Foundation Trust,250 Euston Road,,,London,Greater London,NW1 2PG
RT1,Cambridgeshire and Peterborough NHS Foundation Trust,"Elizabeth House, Fulbourn Hospital",Cambridge Road,Fulbourn,Cambridge,Cambridgeshire,CB21 5EF
RT2,Pennine Care NHS Foundation Trust,225 Old Street,,,Ashton-Under-Lyne,Lancashire,OL6 7SR
RT3,Royal Brompton & Harefield NHS Foundation Trust,Royal Brompton Hospital,Sydney Street,,London,Greater London,SW3 6NP
RT4,Welsh Ambulance Services NHS Trust,PO Box 1064,HM Stanley Hospital,,St Asaph,CLWYD,LL17 0WA
RT5,Leicestershire Partnership NHS Trust,Riverside House,Bridge Park Plaza,"Bridge Park Road, Thurmaston",Leicester,Leicestershire,LE4 8PQ
RTD,The Newcastle Upon Tyne Hospitals NHS Foundation Trust,Freeman Hospital,Freeman Road,High Heaton,Newcastle-Upon-Tyne,Tyne and Wear,NE7 7DN
RTE,Gloucestershire Hospitals NHS Foundation Trust,Trust HQ,Alexandra House,,Cheltenham,Gloucestershire,GL53 7AN
RTF,Northumbria Healthcare NHS Foundation Trust,Rake Lane,,,North Shields,Tyne and Wear,NE29 8NH
RTG,Derby Teaching Hospitals NHS Foundation Trust,Royal Derby Hospital,Uttoxeter Road,,Derby,Derbyshire,DE22 3NE
RTH,Oxford University Hospitals NHS Foundation Trust,John Radcliffe Hospital,Headley Way,Headington,Oxford,Oxfordshire,OX3 9DU
RTK,Ashford and St Peter's Hospitals NHS Foundation Trust,St Peters Hospital,Guildford Road,,Chertsey,Surrey,KT16 0PZ
RTP,Surrey and Sussex Healthcare NHS Trust,East Surrey Hospital,Canada Avenue,,Redhill,Surrey,RH1 5RH
RTQ,2gether NHS Foundation Trust,Rikenel,Montpellier,,Gloucester,Gloucestershire,GL1 1LY
RTR,South Tees Hospitals NHS Foundation Trust,James Cook University Hospital,Marton Road,,Middlesbrough,Cleveland,TS4 3BW
RTV,North West Boroughs Healthcare NHS Foundation Trust,Hollins Park Hospital,Hollins Lane,Winwick,Warrington,Cheshire,WA2 8WA
RTX,University Hospitals of Morecambe Bay NHS Foundation Trust,Westmorland General Hospital,Burton Road,,Kendal,Cumbria,LA9 7RG
RV3,Central and North West London NHS Foundation Trust,Stephenson House,75 Hampstead Road,,London,Greater London,NW1 2PL
RV5,South London and Maudsley NHS Foundation Trust,Maudsley Hospital,Denmark Hill,,London,Greater London,SE5 8AZ
RV9,Humber NHS Foundation Trust,"Trust HQ, Willerby Hill",Beverley Road,Willerby,Hull,North Humberside,HU10 6ED
RVJ,North Bristol NHS Trust,Southmead Hospital,Southmead Road,Westbury-On-TRYM,Bristol,Avon,BS10 5NB
RVN,Avon and Wiltshire Mental Health Partnership NHS Trust,Jenner House,"Avon Way, Langley Park",,Chippenham,Wiltshire,SN15 1GG
RVR,Epsom and St Helier University Hospitals NHS Trust,St Helier Hospital,Wrythe Lane,,Carshalton,Surrey,SM5 1AA
RVV,East Kent Hospitals University NHS Foundation Trust,Kent & Canterbury Hospital,Ethelbert Road,,Canterbury,Kent,CT1 3NG
RVW,North Tees and Hartlepool NHS Foundation Trust,University Hospital of Hartlepool,Holdforth Road,,Hartlepool,Cleveland,TS24 9AH
RVY,Southport and Ormskirk Hospital NHS Trust,Town Lane,,,Southport,Merseyside,PR8 6PN
RW1,Southern Health NHS Foundation Trust,Maples Buildings,Tatchbury Mount Hospital,Calmore,Southampton,Hampshire,SO40 2RZ
RW3,Central Manchester University Hospitals NHS Foundation Trust,"Trust Headquarters, Cobbett House",Manchester Royal Infirmary,Oxford Road,Manchester,Greater Manchester,M13 9WL
RW4,Mersey Care NHS Foundation Trust,8 Princes Parade,,,Liverpool,Merseyside,L3 1DL
RW5,Lancashire Care NHS Foundation Trust,Sceptre Point,Sceptre Way,Bamber Bridge,Preston,Lancashire,PR5 6AW
RW6,Pennine Acute Hospitals NHS Trust,Trust Headquarters,North Manchester General Hospital,"Delaunays Road, Crumpsall",Manchester,Greater Manchester,M8 5RB
RWA,Hull and East Yorkshire Hospitals NHS Trust,Hull Royal Infirmary,Anlaby Road,,Hull,North Humberside,HU3 2JZ
RWD,United Lincolnshire Hospitals NHS Trust,Lincoln County Hospital,Greetwell Road,,Lincoln,Lincolnshire,LN2 4AX
RWE,University Hospitals of Leicester NHS Trust,Leicester Royal Infirmary,Infirmary Square,,Leicester,Leicestershire,LE1 5WW
RWF,Maidstone and Tunbridge Wells NHS Trust,Maidstone Hospital,Hermitage Lane,,Maidstone,Kent,ME16 9QQ
RWG,West Hertfordshire Hospitals NHS Trust,Trust Offices,Watford General Hospital,Vicarage Road,Watford,Hertfordshire,WD18 0HB
RWH,East and North Hertfordshire NHS Trust,Lister Hospital,Coreys Mill Lane,,Stevenage,Hertfordshire,SG1 4AB
RWJ,Stockport NHS Foundation Trust,Stepping Hill Hospital,Poplar Grove,,Stockport,Cheshire,SK2 7JE
RWK,East London NHS Foundation Trust,9 Alie Street,Aldgate,,London,Greater London,E1 8DE
RWN,South Essex Partnership University NHS Foundation Trust,"The Lodge, Runwell Hospital",Runwell Chase,Runwell,Wickford,Essex,SS11 7XX
RWP,Worcestershire Acute Hospitals NHS Trust,Worcestershire Royal Hospital,Charles Hastings Way,,Worcester,Worcestershire,WR5 1DD
RWR,Hertfordshire Partnership University NHS Foundation Trust,99 Waverley Road,,,St. Albans,Hertfordshire,AL3 5TL
RWV,Devon Partnership NHS Trust,Wonford House Hospital,Dryden Road,,Exeter,Devon,EX2 5AF
RWW,Warrington and Halton Hospitals NHS Foundation Trust,Warrington Hospital,Lovely Lane,,Warrington,Cheshire,WA5 1QG
RWX,Berkshire Healthcare NHS Foundation Trust,Fitzwilliam House,Skimped Hill Lane,,Bracknell,Berkshire,RG12 1BQ
RWY,Calderdale and Huddersfield NHS Foundation Trust,Royal Infirmary,Acre Street,,Huddersfield,West Yorkshire,HD3 3EA
RX1,Nottingham University Hospitals NHS Trust,Trust Headquarters,Queens Medical Centre,Derby Road,Nottingham,Nottinghamshire,NG7 2UH
RX2,Sussex Partnership NHS Foundation Trust,Assessment and Treatment Centre,Chapel Street,,Chichester,West Sussex,PO19 1BX
RX3,"Tees, Esk and Wear Valleys NHS Foundation Trust",Trust Headquarters,West Park Hospital,Edward Pease Way,Darlington,County Durham,DL2 2TS
RX4,"Northumberland, Tyne and Wear NHS Foundation Trust",St. Nicholas Hospital,Jubilee Road,Gosforth,Newcastle Upon Tyne,Tyne and Wear,NE3 3XT
RX6,North East Ambulance Service NHS Foundation Trust,Benicia House,Goldcrest Way,Newburn Riverside,Newcastle Upon Tyne,Tyne and Wear,NE15 8NY
RX7,North West Ambulance Service NHS Trust,Ladybridge Hall,399 Chorley New Road,,Bolton,Lancashire,BL1 5DD
RX8,Yorkshire Ambulance Service NHS Trust,"Springhill 2,",Wakefield 41 Industrial Estate,Brindley Way,Wakefield,West Yorkshire,WF2 0XQ
RX9,East Midlands Ambulance Service NHS Trust,1 Horizon Place,Mellors Way,Nottingham Business Park,Nottingham,Nottinghamshire,NG8 6PY
RXA,Cheshire and Wirral Partnership NHS Foundation Trust,Trust Board Offices,Upton Lea Resource Centre,The Countess of Chester Health Park,Chester,Cheshire,CH2 1BQ
RXC,East Sussex Healthcare NHS Trust,St. Annes House,729 the Ridge,,St. Leonards-On-Sea,East Sussex,TN37 7PT
RXE,Rotherham Doncaster and South Humber NHS Foundation Trust,St. Catherine's House,St. Catherine's Hospital,Tickhill Road,Doncaster,South Yorkshire,DN4 8QN
RXF,Mid Yorkshire Hospitals NHS Trust,Rowan House,Aberford Road,,Wakefield,West Yorkshire,WF1 4EE
RXG,South West Yorkshire Partnership NHS Foundation Trust,Trust Headquarters,Fieldhead,Ouchthorpe Lane,Wakefield,West Yorkshire,WF1 3SP
RXH,Brighton and Sussex University Hospitals NHS Trust,Royal Sussex County Hospital,Eastern Road,,Brighton,East Sussex,BN2 5BE
RXK,Sandwell and West Birmingham Hospitals NHS Trust,City Hospital,Dudley Road,,Birmingham,West Midlands,B18 7QH
RXL,Blackpool Teaching Hospitals NHS Foundation Trust,Victoria Hospital,Whinney Heys Road,,Blackpool,Lancashire,FY3 8NR
RXM,Derbyshire Healthcare NHS Foundation Trust,Trust Headquarters,Kingsway Hospital,Kingsway,Derby,Derbyshire,DE22 3LZ
RXN,Lancashire Teaching Hospitals NHS Foundation Trust,Chief Executive's Office,Royal Preston Hospital,"Sharoe Green Lane, Fulwood",Preston,Lancashire,PR2 9HT
RXP,County Durham and Darlington NHS Foundation Trust,Darlington Memorial Hospital,Hollyhurst Road,,Darlington,County Durham,DL3 6HX
RXQ,Buckinghamshire Healthcare NHS Trust,Amersham Hospital,Whielden Street,,Amersham,Buckinghamshire,HP7 0JD
RXR,East Lancashire Hospitals NHS Trust,Royal Blackburn Hospital,Haslingden Road,,Blackburn,Lancashire,BB2 3HH
RXT,Birmingham and Solihull Mental Health NHS Foundation Trust,Unit 1,50 Summer Hill Road,,Birmingham,West Midlands,B1 3RB
RXV,Greater Manchester Mental Health NHS Foundation Trust,Prestwich Hospital,Bury New Road,Prestwich,Manchester,Greater Manchester,M25 3BL
RXW,Shrewsbury and Telford Hospital NHS Trust,Mytton Oak Road,,,Shrewsbury,Shropshire,SY3 8XQ
RXX,Surrey and Borders Partnership NHS Foundation Trust,18 Mole Business Park,Randalls Road,,Leatherhead,Surrey,KT22 7AD
RXY,Kent and Medway NHS and Social Care Partnership Trust,Farm Villa,Hermitage Lane,,Maidstone,Kent,ME16 9PH
RY1,Liverpool Community Health NHS Trust,2 Enterprise Way,,,Liverpool,Merseyside,L13 1FB
RY2,Bridgewater Community Healthcare NHS Foundation Trust,Bevan House,17 Beecham Court,,Wigan,Lancashire,WN3 6PR
RY3,Norfolk Community Health and Care NHS Trust,Elliot House,130 Ber Street,,Norwich,Norfolk,NR1 3FR
RY4,Hertfordshire Community NHS Trust,14 Tewin Road,,,Welwyn Garden City,Hertfordshire,AL7 1BW
RY5,Lincolnshire Community Health Services NHS Trust,Beech House,Witham Park,Waterside South,Lincoln,Lincolnshire,LN5 7JH
RY6,Leeds Community Healthcare NHS Trust,Stockdale House,8 Victoria Road,,Leeds,West Yorkshire,LS6 1PF
RY7,Wirral Community NHS Foundation Trust,Old Market House,Hamilton Street,,Birkenhead,Merseyside,CH41 5AL
RY8,Derbyshire Community Health Services NHS Foundation Trust,Newholme Hospital,Baslow Road,,Bakewell,Derbyshire,DE45 1AD
